Ferme de la bicoque,"Chemin de la Caillaudiere, 45760 Boigny-sur-Bionne","47.9311031,2.0013855",Elevage,TRUE,La ferme a ete reprise en 2014. L'ancien exploitant travaillait en conventionnel depuis 40 ans. Jacques a fait le choix de s'orienter vers le bio.,Vente directe a la ferme,Bio ,Transformation,oui,www.fermebicoque.fr,fermebicoque@gmail.com,,"Brebis, poules",120,3,,,,90,Jacques prevoit de passer en bio d'ici 3ans ,95,Bonnes pratiques agroecologiques,moins travailler sol,86,Bon ancrage territorial,Plus de vente directe,89,Bons resultats economique,Meilleure efficience du travail ,95,Il est tres autonome car produit de l'energie,86,Il produit beaucoup de biens et services,89,il est robuste car adapte au pedoclimat,70,il est ancre car transforme en local ,64,il fait attention a la qualite de vie de ses salaries,36,"La demande en produit agricole va augmenter de 70 en 30ans, tandis que les rendements devraient baisse a cause de la hausse des risques (climatiques, sanitaires, etc.). Assurer la securite alimentaire mondiale et des territoires semble donc être un des points les plus importantes pour une exploitation.","Une alimentation de qualite et en quantite permet de prevenir des risques de maladies chroniques, augmenter le plaisir, developper une culture gastronomique locale et ainsi avoir des humains heureux et en bonnes sante.",L'objectif est de tendre a une forte production locale,6,Score par calcule par production / SAU ,Score car grande production alimentaire (fort rendement) ,80,60,20,6,Score calcule selon la demarche de qualite de l'exploitation  ,Les exploitants sont a la recherche de produits de qualite ,80,60,20,6,Score calcule selon certification de l'exploitation (oui / non ) ,Exploitation certifiee bio ,80,60,20,6,Score calcule selon certification territoriale ,Exploitation AOP ,80,60,20,6,Score calcule selon contrôle qualite ,Contrôle qualite bio et AOP ,80,60,20,6,Score calcule si produits de saison,Exploitation respecte les saisons ,80,60,20,6,"Afin de garder une certaine autonomie, agilite, et reduire les coups, il semble important de maximiser la collaboration","La collaboration permet de favoriser l'ancrage territoriale, la dynamique de groupe et l'entraide sociale",Objectif mise en commun du travail ,6,Score si appartenance a une CUMA ,Exploitation appartenant a une CUMA ,80,60,20,6,Score si appartenance a un groupement d'employeurs,Exploitation n'appartenant pas a un groupement ,80,60,20,6,Score si travail en reseau ,Exploitation appartenant a un groupe de travail ,80,60,20,6,Score selon implication dans le reseau ,President du reseau ,80,60,20,6,Score selon les benefices de la coop ,Aucun benefice car non membre ,80,60,20,74,"L'effondrement de la biodivirsité est avec le dérèglement climatique la deuxième grande crise écologique de notre temps. L'agriculture en est la principale cause. A l'inverse si elle est bien conduite, elle en être le principal catalyseur. L'agriculteur est le médiateur de la nature.","Une riche biodiversité permet à celle-ci de continuer à se développer et surtout fournir des services écosystèmiques dont nous sommes tant dépendant (eau, protection face aux maladies, etc.) ","La biodiversité est un élément très compliqué à mesurer et suivre. D'autant que l'objectif premier de l'agriculture étant de produit des aliments, le savant mélange entre viabilité économique et préservation de la biodiversité qui n'est malheureusement pas valorisé économique est complexe.",6,Score selon taux de gaspillage alimentaire ,Faible taux de gaspillage,80,60,20,6,Score selon mesures de reduction du gaspillage ,Pas de mesures prises ,80,60,20,6,Score si valorisation des dechets organiques ,Valorisation aupres usine locale,80,60,20,6,Score selon taux de rejet d'effluents organiques liquides,Faible taux ,80,60,20,79,"Des bonnes cultures, c'est un sol en bonne sante. Cela previent des maladies, renforce la qualite nutritionnelle des produits, et stocke du carbone en quantite (4/1000)",Score eleve car bonne gestion et valorisation des dechets ,Objectif de favoriser l'economie circulaire ,6,Score selon taux de gaspillage alimentaire ,Faible taux de gaspillage,80,60,20,6,Score selon mesures de reduction du gaspillage ,Pas de mesures prises ,80,60,20,6,Score si valorisation des dechets organiques ,Valorisation aupres usine locale,80,60,20,6,Score selon taux de rejet d'effluents organiques liquides,Faible taux ,80,60,20,26,"Il existe une forte disparité au niveau de la pérennité des exploitations agricole. En France, de nombreuses exploitations sont dans des situations compliqués mettant en grande précarité ses exploitants.","Une exploitation pérenne permet à l'agriculteur de mieux vivre de son travail, en situation moins de stress et d'attirer de nouvelles personnes qui sont nécessaire au renouvellement des générations et à la baisse des émissions carbones de notre société.","Le système a rendu les exploitations de plus en plus fragiles économiquement, en les obligeant à produire à moindre coûts sans mettre de rémunération sur les autres valeurs produites par l'agriculture.",6,Score selon taux de gaspillage alimentaire ,Faible taux de gaspillage,80,60,20,6,Score selon mesures de reduction du gaspillage ,Pas de mesures prises ,80,60,20,6,Score si valorisation des dechets organiques ,Valorisation aupres usine locale,80,60,20,6,Score selon taux de rejet d'effluents organiques liquides,Faible taux ,80,60,20,43,"Une exploitation indépendante économique va lui permette d'être plus agile en cas de crise, orienté plus facilement sa stratégie à son contexte et envies","Une exploitation indépendante économique va lui permette d'être plus agile en cas de crise, orienté plus facilement sa stratégie à son contexte et envies",Etre indépendant économiquement signifie avoir plusieurs sources de revenus et donc rajouter une complexité supplémentaire dans la gestion de la ferme,6,Score selon taux de gaspillage alimentaire ,Faible taux de gaspillage,80,60,20,6,Score selon mesures de reduction du gaspillage ,Pas de mesures prises ,80,60,20,6,Score si valorisation des dechets organiques ,Valorisation aupres usine locale,80,60,20,6,Score selon taux de rejet d'effluents organiques liquides,Faible taux ,80,60,20
Ferme de la bon coin ,"128 Rue Gauthier, 59400 Cambrai","50.1745878,3.1217783",Grandes cultures ,TRUE,"Histoire, projet... ",Vente directe par envoi; Cueillette,ACS ,Artisanat; Gites,non,www.fermeduboncoin.fr,fermeduboncoin@gmail.com,,"Ble, mais, colza, sarrasin",222,4,,,,53,Paul est en transition bio. Il cherche donc a ameliorer son systeme agronomique pour ameliorer ses rendements et la qualite de ses produits.,20,Bonnes pratiques agroecologiques,moins travailler sol,90,Bon ancrage territorial,Plus de vente directe,40,Bons resultats economique,Meilleure efficience du travail ,20,Il est tres autonome car produit de l'energie,90,Il produit beaucoup de biens et services,40,il est robuste car adapte au pedoclimat,60,il est ancre car transforme en local ,82,il fait attention a la qualite de vie de ses salaries,48,"La demande en produit agricole va augmenter de 70 en 30ans, tandis que les rendements devraient baisse a cause de la hausse des risques (climatiques, sanitaires, etc.). Assurer la securite alimentaire mondiale et des territoires semble donc être un des points les plus importantes pour une exploitation.","Une alimentation de qualite et en quantite permet de prevenir des risques de maladies chroniques, augmenter le plaisir, developper une culture gastronomique locale et ainsi avoir des humains heureux et en bonnes sante.",L'objectif est de tendre a une forte production locale,8,Score par calcule par production / SAU ,Score car grande production alimentaire (fort rendement) ,80,60,20,8,Score calcule selon la demarche de qualite de l'exploitation  ,Les exploitants sont a la recherche de produits de qualite ,80,60,20,8,Score calcule selon certification de l'exploitation (oui / non ) ,Exploitation certifiee bio ,80,60,20,8,Score calcule selon certification territoriale ,Exploitation AOP ,80,60,20,8,Score calcule selon contrôle qualite ,Contrôle qualite bio et AOP ,80,60,20,8,Score calcule si produits de saison,Exploitation respecte les saisons ,80,60,20,8,"Afin de garder une certaine autonomie, agilite, et reduire les coups, il semble important de maximiser la collaboration","La collaboration permet de favoriser l'ancrage territoriale, la dynamique de groupe et l'entraide sociale",Objectif mise en commun du travail ,8,Score si appartenance a une CUMA ,Exploitation appartenant a une CUMA ,80,60,20,8,Score si appartenance a un groupement d'employeurs,Exploitation n'appartenant pas a un groupement ,80,60,20,8,Score si travail en reseau ,Exploitation appartenant a un groupe de travail ,80,60,20,8,Score selon implication dans le reseau ,President du reseau ,80,60,20,8,Score selon les benefices de la coop ,Aucun benefice car non membre ,80,60,20,25,"L'effondrement de la biodivirsité est avec le dérèglement climatique la deuxième grande crise écologique de notre temps. L'agriculture en est la principale cause. A l'inverse si elle est bien conduite, elle en être le principal catalyseur. L'agriculteur est le médiateur de la nature.","Une riche biodiversité permet à celle-ci de continuer à se développer et surtout fournir des services écosystèmiques dont nous sommes tant dépendant (eau, protection face aux maladies, etc.) ","La biodiversité est un élément très compliqué à mesurer et suivre. D'autant que l'objectif premier de l'agriculture étant de produit des aliments, le savant mélange entre viabilité économique et préservation de la biodiversité qui n'est malheureusement pas valorisé économique est complexe.",4,Score selon taux de gaspillage alimentaire ,Faible taux de gaspillage,80,60,20,4,Score selon mesures de reduction du gaspillage ,Pas de mesures prises ,80,60,20,4,Score si valorisation des dechets organiques ,Valorisation aupres usine locale,80,60,20,4,Score selon taux de rejet d'effluents organiques liquides,Faible taux ,80,60,20,18,"Des bonnes cultures, c'est un sol en bonne sante. Cela previent des maladies, renforce la qualite nutritionnelle des produits, et stocke du carbone en quantite (4/1000)",Score eleve car bonne gestion et valorisation des dechets ,Objectif de favoriser l'economie circulaire ,4,Score selon taux de gaspillage alimentaire ,Faible taux de gaspillage,80,60,20,4,Score selon mesures de reduction du gaspillage ,Pas de mesures prises ,80,60,20,4,Score si valorisation des dechets organiques ,Valorisation aupres usine locale,80,60,20,4,Score selon taux de rejet d'effluents organiques liquides,Faible taux ,80,60,20,24,"Il existe une forte disparité au niveau de la pérennité des exploitations agricole. En France, de nombreuses exploitations sont dans des situations compliqués mettant en grande précarité ses exploitants.","Une exploitation pérenne permet à l'agriculteur de mieux vivre de son travail, en situation moins de stress et d'attirer de nouvelles personnes qui sont nécessaire au renouvellement des générations et à la baisse des émissions carbones de notre société.","Le système a rendu les exploitations de plus en plus fragiles économiquement, en les obligeant à produire à moindre coûts sans mettre de rémunération sur les autres valeurs produites par l'agriculture.",4,Score selon taux de gaspillage alimentaire ,Faible taux de gaspillage,80,60,20,4,Score selon mesures de reduction du gaspillage ,Pas de mesures prises ,80,60,20,4,Score si valorisation des dechets organiques ,Valorisation aupres usine locale,80,60,20,4,Score selon taux de rejet d'effluents organiques liquides,Faible taux ,80,60,20,25,"Les exploitations sont devenus fortement dépendante des aides de la PAC, et sont bien souvent liée à leur coopérative","Une exploitation indépendante économique va lui permette d'être plus agile en cas de crise, orienté plus facilement sa stratégie à son contexte et envies",Etre indépendant économiquement signifie avoir plusieurs sources de revenus et donc rajouter une complexité supplémentaire dans la gestion de la ferme,4,Score selon taux de gaspillage alimentaire ,Faible taux de gaspillage,80,60,20,4,Score selon mesures de reduction du gaspillage ,Pas de mesures prises ,80,60,20,4,Score si valorisation des dechets organiques ,Valorisation aupres usine locale,80,60,20,4,Score selon taux de rejet d'effluents organiques liquides,Faible taux ,80,60,20
Ferme de la Beausse,"Route Nationale 8, 83330 Le Beausset","43.1988647,5.8256255",Maraichage,FALSE,Une jolie petite ferme familiale sans pretention,Cueillette; Marche; Circuit-Court; Filiere longue,Bio,Ferme pedagogique,non,www.fermeBeausse.fr,fermebeausse@gmail.com,,"Fraises, melon, courgettes, aubergines",10,2,,,,70,Jacques prevoit de passer en bio d'ici 3ans ,50,Bonnes pratiques agroecologiques,moins travailler sol,90,Bon ancrage territorial,Plus de vente directe,40,Bons resultats economique,Meilleure efficience du travail ,50,Il est tres autonome car produit de l'energie,90,Il produit beaucoup de biens et services,40,il est robuste car adapte au pedoclimat,55,il est ancre car transforme en local ,46,il fait attention a la qualite de vie de ses salaries,48,"La demande en produit agricole va augmenter de 70 en 30ans, tandis que les rendements devraient baisse a cause de la hausse des risques (climatiques, sanitaires, etc.). Assurer la securite alimentaire mondiale et des territoires semble donc être un des points les plus importantes pour une exploitation.","Une alimentation de qualite et en quantite permet de prevenir des risques de maladies chroniques, augmenter le plaisir, developper une culture gastronomique locale et ainsi avoir des humains heureux et en bonnes sante.",L'objectif est de tendre a une forte production locale,8,Score par calcule par production / SAU ,Score car grande production alimentaire (fort rendement) ,80,60,20,8,Score calcule selon la demarche de qualite de l'exploitation  ,Les exploitants sont a la recherche de produits de qualite ,80,60,20,8,Score calcule selon certification de l'exploitation (oui / non ) ,Exploitation certifiee bio ,80,60,20,8,Score calcule selon certification territoriale ,Exploitation AOP ,80,60,20,8,Score calcule selon contrôle qualite ,Contrôle qualite bio et AOP ,80,60,20,8,Score calcule si produits de saison,Exploitation respecte les saisons ,80,60,20,8,"Afin de garder une certaine autonomie, agilite, et reduire les coups, il semble important de maximiser la collaboration","La collaboration permet de favoriser l'ancrage territoriale, la dynamique de groupe et l'entraide sociale",Objectif mise en commun du travail ,8,Score si appartenance a une CUMA ,Exploitation appartenant a une CUMA ,80,60,20,8,Score si appartenance a un groupement d'employeurs,Exploitation n'appartenant pas a un groupement ,80,60,20,8,Score si travail en reseau ,Exploitation appartenant a un groupe de travail ,80,60,20,8,Score selon implication dans le reseau ,President du reseau ,80,60,20,8,Score selon les benefices de la coop ,Aucun benefice car non membre ,80,60,20,34,"L'effondrement de la biodivirsité est avec le dérèglement climatique la deuxième grande crise écologique de notre temps. L'agriculture en est la principale cause. A l'inverse si elle est bien conduite, elle en être le principal catalyseur. L'agriculteur est le médiateur de la nature.","Une riche biodiversité permet à celle-ci de continuer à se développer et surtout fournir des services écosystèmiques dont nous sommes tant dépendant (eau, protection face aux maladies, etc.) ","La biodiversité est un élément très compliqué à mesurer et suivre. D'autant que l'objectif premier de l'agriculture étant de produit des aliments, le savant mélange entre viabilité économique et préservation de la biodiversité qui n'est malheureusement pas valorisé économique est complexe.",4,Score selon taux de gaspillage alimentaire ,Faible taux de gaspillage,80,60,20,4,Score selon mesures de reduction du gaspillage ,Pas de mesures prises ,80,60,20,4,Score si valorisation des dechets organiques ,Valorisation aupres usine locale,80,60,20,4,Score selon taux de rejet d'effluents organiques liquides,Faible taux ,80,60,20,34,"Des bonnes cultures, c'est un sol en bonne sante. Cela previent des maladies, renforce la qualite nutritionnelle des produits, et stocke du carbone en quantite (4/1000)",Score eleve car bonne gestion et valorisation des dechets ,Objectif de favoriser l'economie circulaire ,4,Score selon taux de gaspillage alimentaire ,Faible taux de gaspillage,80,60,20,4,Score selon mesures de reduction du gaspillage ,Pas de mesures prises ,80,60,20,4,Score si valorisation des dechets organiques ,Valorisation aupres usine locale,80,60,20,4,Score selon taux de rejet d'effluents organiques liquides,Faible taux ,80,60,20,24,"Il existe une forte disparité au niveau de la pérennité des exploitations agricole. En France, de nombreuses exploitations sont dans des situations compliqués mettant en grande précarité ses exploitants.","Une exploitation pérenne permet à l'agriculteur de mieux vivre de son travail, en situation moins de stress et d'attirer de nouvelles personnes qui sont nécessaire au renouvellement des générations et à la baisse des émissions carbones de notre société.","Le système a rendu les exploitations de plus en plus fragiles économiquement, en les obligeant à produire à moindre coûts sans mettre de rémunération sur les autres valeurs produites par l'agriculture.",4,Score selon taux de gaspillage alimentaire ,Faible taux de gaspillage,80,60,20,4,Score selon mesures de reduction du gaspillage ,Pas de mesures prises ,80,60,20,4,Score si valorisation des dechets organiques ,Valorisation aupres usine locale,80,60,20,4,Score selon taux de rejet d'effluents organiques liquides,Faible taux ,80,60,20,34,"Les exploitations sont devenus fortement dépendante des aides de la PAC, et sont bien souvent liée à leur coopérative","Une exploitation indépendante économique va lui permette d'être plus agile en cas de crise, orienté plus facilement sa stratégie à son contexte et envies",Etre indépendant économiquement signifie avoir plusieurs sources de revenus et donc rajouter une complexité supplémentaire dans la gestion de la ferme,4,Score selon taux de gaspillage alimentaire ,Faible taux de gaspillage,80,60,20,4,Score selon mesures de reduction du gaspillage ,Pas de mesures prises ,80,60,20,4,Score si valorisation des dechets organiques ,Valorisation aupres usine locale,80,60,20,4,Score selon taux de rejet d'effluents organiques liquides,Faible taux ,80,60,20
Ferme du Ranquet,"68 impasse de l'aubepine, 34190 Laroque","43.9634113,3.7108445",Maraichage,FALSE,"Histoire, projet... ",Circuit-Court; Filiere longue,Raisonne,Visites / Portes ouvertes,non,www.fermeRanquet.fr,fermeranquet@gmail.com,,"Fraises, melon, courgettes, aubergines",15,2,,,,45,Jacques prevoit de passer en bio d'ici 3ans ,20,Bonnes pratiques agroecologiques,moins travailler sol,90,Bon ancrage territorial,Plus de vente directe,70,Bons resultats economique,Meilleure efficience du travail ,20,Il est tres autonome car produit de l'energie,90,Il produit beaucoup de biens et services,70,il est robuste car adapte au pedoclimat,80,il est ancre car transforme en local ,73,il fait attention a la qualite de vie de ses salaries,48,"La demande en produit agricole va augmenter de 70 en 30ans, tandis que les rendements devraient baisse a cause de la hausse des risques (climatiques, sanitaires, etc.). Assurer la securite alimentaire mondiale et des territoires semble donc être un des points les plus importantes pour une exploitation.","Une alimentation de qualite et en quantite permet de prevenir des risques de maladies chroniques, augmenter le plaisir, developper une culture gastronomique locale et ainsi avoir des humains heureux et en bonnes sante.",L'objectif est de tendre a une forte production locale,8,Score par calcule par production / SAU ,Score car grande production alimentaire (fort rendement) ,80,60,20,8,Score calcule selon la demarche de qualite de l'exploitation  ,Les exploitants sont a la recherche de produits de qualite ,80,60,20,8,Score calcule selon certification de l'exploitation (oui / non ) ,Exploitation certifiee bio ,80,60,20,8,Score calcule selon certification territoriale ,Exploitation AOP ,80,60,20,8,Score calcule selon contrôle qualite ,Contrôle qualite bio et AOP ,80,60,20,8,Score calcule si produits de saison,Exploitation respecte les saisons ,80,60,20,8,"Afin de garder une certaine autonomie, agilite, et reduire les coups, il semble important de maximiser la collaboration","La collaboration permet de favoriser l'ancrage territoriale, la dynamique de groupe et l'entraide sociale",Objectif mise en commun du travail ,8,Score si appartenance a une CUMA ,Exploitation appartenant a une CUMA ,80,60,20,8,Score si appartenance a un groupement d'employeurs,Exploitation n'appartenant pas a un groupement ,80,60,20,8,Score si travail en reseau ,Exploitation appartenant a un groupe de travail ,80,60,20,8,Score selon implication dans le reseau ,President du reseau ,80,60,20,8,Score selon les benefices de la coop ,Aucun benefice car non membre ,80,60,20,89,"L'effondrement de la biodivirsité est avec le dérèglement climatique la deuxième grande crise écologique de notre temps. L'agriculture en est la principale cause. A l'inverse si elle est bien conduite, elle en être le principal catalyseur. L'agriculteur est le médiateur de la nature.","Une riche biodiversité permet à celle-ci de continuer à se développer et surtout fournir des services écosystèmiques dont nous sommes tant dépendant (eau, protection face aux maladies, etc.) ","La biodiversité est un élément très compliqué à mesurer et suivre. D'autant que l'objectif premier de l'agriculture étant de produit des aliments, le savant mélange entre viabilité économique et préservation de la biodiversité qui n'est malheureusement pas valorisé économique est complexe.",4,Score selon taux de gaspillage alimentaire ,Faible taux de gaspillage,80,60,20,4,Score selon mesures de reduction du gaspillage ,Pas de mesures prises ,80,60,20,4,Score si valorisation des dechets organiques ,Valorisation aupres usine locale,80,60,20,4,Score selon taux de rejet d'effluents organiques liquides,Faible taux ,80,60,20,67,"Des bonnes cultures, c'est un sol en bonne sante. Cela previent des maladies, renforce la qualite nutritionnelle des produits, et stocke du carbone en quantite (4/1000)",Score eleve car bonne gestion et valorisation des dechets ,Objectif de favoriser l'economie circulaire ,4,Score selon taux de gaspillage alimentaire ,Faible taux de gaspillage,80,60,20,4,Score selon mesures de reduction du gaspillage ,Pas de mesures prises ,80,60,20,4,Score si valorisation des dechets organiques ,Valorisation aupres usine locale,80,60,20,4,Score selon taux de rejet d'effluents organiques liquides,Faible taux ,80,60,20,24,"Il existe une forte disparité au niveau de la pérennité des exploitations agricole. En France, de nombreuses exploitations sont dans des situations compliqués mettant en grande précarité ses exploitants.","Une exploitation pérenne permet à l'agriculteur de mieux vivre de son travail, en situation moins de stress et d'attirer de nouvelles personnes qui sont nécessaire au renouvellement des générations et à la baisse des émissions carbones de notre société.","Le système a rendu les exploitations de plus en plus fragiles économiquement, en les obligeant à produire à moindre coûts sans mettre de rémunération sur les autres valeurs produites par l'agriculture.",4,Score selon taux de gaspillage alimentaire ,Faible taux de gaspillage,80,60,20,4,Score selon mesures de reduction du gaspillage ,Pas de mesures prises ,80,60,20,4,Score si valorisation des dechets organiques ,Valorisation aupres usine locale,80,60,20,4,Score selon taux de rejet d'effluents organiques liquides,Faible taux ,80,60,20,67,"Les exploitations sont devenus fortement dépendante des aides de la PAC, et sont bien souvent liée à leur coopérative","Une exploitation indépendante économique va lui permette d'être plus agile en cas de crise, orienté plus facilement sa stratégie à son contexte et envies",Etre indépendant économiquement signifie avoir plusieurs sources de revenus et donc rajouter une complexité supplémentaire dans la gestion de la ferme,4,Score selon taux de gaspillage alimentaire ,Faible taux de gaspillage,80,60,20,4,Score selon mesures de reduction du gaspillage ,Pas de mesures prises ,80,60,20,4,Score si valorisation des dechets organiques ,Valorisation aupres usine locale,80,60,20,4,Score selon taux de rejet d'effluents organiques liquides,Faible taux ,80,60,20
